{
  "$schema": "./manifest-v2.schema.json",
  "schema_version": "2.0.0",
  "manifest_id": "i3cex-bakeoff-v2",
  "status": "frozen_preimplementation_design",
  "created": "2026-07-16",
  "specification": "I3CEX-0.2.0-draft",
  "baseline_commit": "e0a098c3dbc30bfe8f2c59102f6472b174c286c9",
  "labeled_measurements_enabled": false,
  "next_required_manifest": "manifest-v3-execution",
  "standards_baseline": {
    "name": "MIPI I3C Basic",
    "version": "1.2",
    "adopted": "2025-04-17",
    "public_baseline_verified": "2026-07-16",
    "official_url": "https://www.mipi.org/specifications/i3c-sensor-specification",
    "transport_boundary": "Private SDR after endpoint-specific SETBUSCON context selection and capability negotiation",
    "identifier_policy": "symbolic_or_deliberately_configured_private_only_until_assignment",
    "conformance_claim_policy": "base_i3c_and_i3cex_reported_separately"
  },
  "extends_manifest": {
    "id": "i3cex-extensibility-v1",
    "path": "experiments/extensibility/manifest-v1.json",
    "sha256": "157413beeb461a42c531bb1422d48bd345e5cda4ee87ccac185f35459db4f033",
    "expected_core_cells": 192,
    "mutation_policy": "immutable"
  },
  "methodology_adrs": [
    {"id": "ADR-0011", "status": "accepted", "path": "docs/adr/0011-python-c-side-by-side-measurement.md"},
    {"id": "ADR-0012", "status": "accepted", "path": "docs/adr/0012-extensibility-scenario-taxonomy.md"},
    {"id": "ADR-0013", "status": "accepted", "path": "docs/adr/0013-extensibility-coverage-strategy.md"},
    {"id": "ADR-0014", "status": "accepted", "path": "docs/adr/0014-extensibility-per-scenario-measurements.md"},
    {"id": "ADR-0016", "status": "accepted", "path": "docs/adr/0016-wire-overhead-methodology.md"},
    {"id": "ADR-0017", "status": "accepted", "path": "docs/adr/0017-parse-complexity-methodology.md"},
    {"id": "ADR-0018", "status": "accepted", "path": "docs/adr/0018-legacy-safety-methodology.md"},
    {"id": "ADR-0019", "status": "accepted", "path": "docs/adr/0019-bounded-worst-case-latency-methodology.md"},
    {"id": "ADR-0020", "status": "accepted", "path": "docs/adr/0020-throughput-impact-methodology.md"}
  ],
  "master_seed": 20260716,
  "candidates": ["preamble", "tlv"],
  "directions": [
    {"id": "controller_to_target", "budget_source": "SETMWL"},
    {"id": "target_to_controller", "budget_source": "SETMRL"}
  ],
  "operations": ["encode", "decode", "skip_unknown_optional", "reject_invalid"],
  "shared_workload_grid": {
    "capability_levels": [1, 2, 3, 4, 5, 6],
    "application_value_bytes": [0, 1, 4, 8, 16, 32, 64, 127, 128, 255, 256, 1024, 4096],
    "record_counts": [1, 2, 4, 6, 16, 64, 127, 128, 255],
    "directional_content_budget_bytes": [64, 128, 256, 512, 4096, 8192],
    "session_lengths": [1, 10, 100, 1000, 1000000],
    "boundary_rule": "include_one_below_at_and_one_above_every_candidate_or_negotiated_boundary",
    "cell_policy": "retain_every_cross_product_cell_and_label_valid_fragmented_unsupported_or_infeasible",
    "expected_candidate_direction_cells": 84240
  },
  "cross_language_runtime": {
    "semantic_gate": "bit_identical_encode_decode_and_outcome_class_before_timing",
    "c": {
      "standard": "freestanding ISO C11",
      "dynamic_allocation_in_timed_path": false,
      "primary_target": "ST NUCLEO-F072RB / STM32F072RB / Cortex-M0",
      "maximum_core_clock_hz": 48000000,
      "timer": "Cortex-M SysTick 24-bit processor-clock counter",
      "primary_flags": ["-std=c11", "-mcpu=cortex-m0", "-mthumb", "-O2", "-fno-lto"],
      "replication_flags": ["-std=c11", "-mcpu=cortex-m0", "-mthumb", "-Os", "-fno-lto"]
    },
    "python": {
      "implementation": "CPython",
      "primary_version_line": "3.12",
      "replication_version_lines": ["3.11", "3.13"],
      "timer": "time.perf_counter_ns"
    },
    "repetitions": {
      "independent_blocks": 30,
      "warmup_batches_per_block": 100,
      "timed_batches_per_block": 1000,
      "fresh_process_or_hardware_reset_per_block": true,
      "outlier_removal": false,
      "optional_stopping": false
    }
  },
  "axes": {
    "axis_1_wire_overhead": {
      "adr": "ADR-0016",
      "method": "exact_analytical_accounting_cross_checked_against_emitted_bytes",
      "primary_components": [
        "candidate_framing_bytes",
        "padding_bytes",
        "fragmentation_bytes",
        "fragment_count"
      ],
      "context_components": [
        "application_content_bytes",
        "base_i3c_bytes",
        "i3cex_common_bytes",
        "one_time_setup_bytes"
      ],
      "derived_metrics": [
        "recurring_wire_bytes",
        "payload_efficiency",
        "remaining_content_budget",
        "amortized_bytes_per_message"
      ],
      "zero_payload_efficiency_rule": "one_only_when_recurring_wire_bytes_is_zero_otherwise_zero",
      "uncertainty_interval": "not_applicable_exact_integer_accounting",
      "grid_reference": "shared_workload_grid",
      "extensibility_scenarios_applied_when_representable": true
    },
    "axis_2_parse_complexity": {
      "adr": "ADR-0017",
      "primary_language": "c",
      "replication_language": "python",
      "analyzer_family": "Lizard McCabe cyclomatic complexity",
      "source_metrics": [
        "cyclomatic_complexity_sum",
        "cyclomatic_complexity_median",
        "cyclomatic_complexity_p90",
        "cyclomatic_complexity_maximum",
        "functions_above_complexity_10",
        "function_count",
        "logical_noncomment_sloc",
        "token_count",
        "parser_states",
        "parser_transitions",
        "maximum_nesting_depth",
        "validation_error_exits"
      ],
      "embedded_metrics": [
        "text_bytes",
        "rodata_bytes",
        "data_bytes",
        "bss_bytes",
        "maximum_bounded_stack_bytes",
        "scratch_bytes"
      ],
      "binary_sources": ["GNU size System V output", "linker map", "GCC fstack-usage", "ELF", "disassembly"],
      "generated_code_and_tables_included": true,
      "composite_score_allowed": false
    },
    "axis_3_extensibility": {
      "adrs": ["ADR-0012", "ADR-0013", "ADR-0014"],
      "manifest_reference": "extends_manifest",
      "expected_core_cells": 192,
      "core_cell_coverage_percent": 100,
      "boundary_coverage_percent": 100,
      "valid_two_way_nuisance_coverage_percent": 100
    },
    "axis_4_legacy_safety": {
      "adr": "ADR-0018",
      "peer_classes": ["plain_or_unnegotiated_i3c", "version_skewed_i3cex", "malformed_or_misbehaving_i3cex"],
      "state_events": [
        "reset",
        "dynamic_address_assignment",
        "context_change",
        "negotiation_success",
        "negotiation_failure",
        "endpoint_restart",
        "stale_capability_cache",
        "version_downgrade"
      ],
      "deterministic_mutations": [
        "each_control_bit_flip",
        "truncate_at_each_framing_byte",
        "trailing_bytes",
        "length_boundary_minus_at_plus_one",
        "reserved_value",
        "unknown_optional",
        "unknown_critical",
        "duplicate_omit_reorder",
        "record_block_setmwl_setmrl_cap_overrun",
        "wrong_version_capability_context_direction_endpoint"
      ],
      "python_property_campaign": {
        "engine": "Hypothesis stateful and property testing",
        "database": null,
        "deadline": null,
        "max_examples_per_seed_candidate_target": 10000,
        "seed_count": 10,
        "phases": ["generate", "target", "shrink"],
        "health_check_suppressions": []
      },
      "c_fuzz_campaign": {
        "engine": "LLVM libFuzzer",
        "targets": ["decode_block", "negotiation_state_sequence"],
        "sanitizer_profiles": ["address", "undefined"],
        "seed_count": 10,
        "runs_per_seed_candidate_target_profile": 1000000,
        "maximum_input_bytes": 8192,
        "expected_executions_per_candidate": 40000000,
        "time_based_stopping": false,
        "project_code_suppressions_allowed": false
      },
      "embedded_replay": "all_deterministic_vectors_all_minimized_findings_and_greedy_edge_cover_of_final_corpus",
      "unsafe_tolerance": 0
    },
    "axis_5_bounded_worst_case_latency": {
      "adr": "ADR-0019",
      "claim_labels": ["safe_wcet_upper_bound", "bounded_domain_maximum", "maximum_observed"],
      "decomposition": [
        "sender_compute_cycles",
        "candidate_induced_wire_occupancy",
        "receiver_compute_cycles",
        "fragment_count",
        "one_time_setup_cost"
      ],
      "grid_reference": "shared_workload_grid",
      "operations_reference": "operations",
      "error_positions": ["first", "middle", "last"],
      "primary_interrupt_policy": "disabled_only_inside_protocol_intrinsic_timed_region",
      "cycles_reported_before_time_conversion": true,
      "sampled_maximum_may_be_called_wcet": false,
      "static_analysis_required_for_safe_bound_claim": true
    },
    "axis_6_throughput": {
      "adr": "ADR-0020",
      "primary_metric": "successfully_delivered_application_bytes_per_elapsed_second",
      "secondary_metrics": [
        "logical_messages_per_second",
        "bus_utilization",
        "cycles_per_delivered_application_byte",
        "wire_bytes_per_delivered_application_byte",
        "fragments_per_message",
        "queue_high_water_mark"
      ],
      "grid_reference": "shared_workload_grid",
      "analytical_ceiling_required_for_every_valid_cell": true,
      "empirical_search": {
        "method": "bracketed_binary_search_of_scheduled_open_loop_offered_rate",
        "warmup_logical_messages": 10000,
        "measured_logical_messages_per_trial": 1000000,
        "independent_final_pair_blocks": 30,
        "passing_criteria": [
          "zero_loss",
          "zero_duplication",
          "zero_parse_errors",
          "zero_required_ordering_errors",
          "end_backlog_not_greater_than_start_after_frozen_drain_window"
        ],
        "time_based_stopping": false,